{
  "schema": "qw5.memory-baseline/v1",
  "artifact_role": "schema_fixture",
  "evidence_class": "SIMULATED",
  "created_at": "2000-01-01T00:01:00Z",
  "node_alias": "A",
  "producer": {
    "name": "qw5-schema-fixture",
    "version": "1",
    "executable_sha256": "1414141414141414141414141414141414141414141414141414141414141414",
    "qw5_commit": "1414141414141414141414141414141414141414",
    "dirty": false
  },
  "inventory_sha256": "1515151515151515151515151515151515151515151515151515151515151515",
  "policy": {
    "approval_status": "owner_approval_required",
    "stabilization_duration_ns": 600000000000,
    "sample_interval_ns": 60000000000,
    "planned_valid_samples": 30,
    "maximum_attempts": 36,
    "baseline_statistic": "nearest-rank-p05-available-bytes",
    "required_thermal_state": "nominal",
    "low_power_mode_required": false,
    "clean_window_definition": "Synthetic fixture; no real process or machine observation."
  },
  "stabilization": {
    "started_at": "1999-12-31T23:50:00Z",
    "ended_at": "2000-01-01T00:00:00Z",
    "start_monotonic_ns": 0,
    "end_monotonic_ns": 600000000000,
    "observed_duration_ns": 600000000000
  },
  "metal_working_set_guidance": {
    "status": "unavailable",
    "source_fact_id": "gpu.recommended_working_set_bytes",
    "interpretation": "guidance_not_available_memory"
  },
  "samples": [
    {
      "attempt_index": 1,
      "valid": true,
      "invalid_reasons": [],
      "observed_at": "2000-01-01T00:00:00Z",
      "monotonic_ns": 600000000000,
      "physical_bytes": 32,
      "available_bytes": 24,
      "memory_pressure": "nominal",
      "thermal_state": "nominal",
      "low_power_mode": false,
      "power_source": null,
      "clean_window_verified": true,
      "errors": []
    }
  ],
  "summary": {
    "status": "ABORTED",
    "attempted_samples": 1,
    "accepted_samples": 1,
    "rejected_samples": 0,
    "physical_bytes": 32,
    "p05_available_bytes": 24,
    "minimum_available_bytes": 24,
    "maximum_available_bytes": 24,
    "observed_os_reserve_bytes": 8
  },
  "errors": [
    {"code": "FIXTURE_STOP", "message": "Synthetic fixture intentionally stops after one sample."}
  ]
}
